{
  "schema_version":"anpr-image-inference-response-v1","request_id":"01JQABCDEFGHJKMNPQRSTVWXYZ","status":"no_plate_detected",
  "models":{"detection":{"model_id":"detection-v3-20260827","sha256":"0d5e9b52fae5638e0ef1badafdeb53fe0771d056e43c4953d13cceed520e71ea"},"recognition":{"model_id":"m3-v4-stroke-20260914","sha256":"25b6e4af757b87da75162293a28274e3a0ecbb7f29bc55489b7132e353ad5ff7"}},
  "detection":{"state":"not_found","box_xyxy_normalized":null,"confidence":null},"crop_refinement":{"state":"not_run","method":null},
  "recognition":{"prediction":null,"confidence":null},"structural_validation":"not_run","human_review_required":true,"annotated_image":null,
  "timings_ms":{"total":180,"validation":20,"detection":160,"crop_refinement":0,"recognition":0},"warnings":[]
}
