{
  "schema_version":"anpr-image-inference-response-v1","request_id":"01JQABCDEFGHJKMNPQRSTVWXYZ","status":"unresolved",
  "models":{"detection":{"model_id":"detection-v3-20260827","sha256":"0d5e9b52fae5638e0ef1badafdeb53fe0771d056e43c4953d13cceed520e71ea"},"recognition":{"model_id":"m3-v4-stroke-20260914","sha256":"25b6e4af757b87da75162293a28274e3a0ecbb7f29bc55489b7132e353ad5ff7"}},
  "detection":{"state":"found","box_xyxy_normalized":[0.1,0.2,0.8,0.7],"confidence":0.75},"crop_refinement":{"state":"applied","method":"BLUE_BAND_GLYPH_QUAD_V1"},
  "recognition":{"prediction":"34 ABC 12","confidence":0.42},"structural_validation":"invalid","human_review_required":true,"annotated_image":null,
  "timings_ms":{"total":410,"validation":20,"detection":180,"crop_refinement":40,"recognition":170},"warnings":["LOW_RECOGNITION_CONFIDENCE","STRUCTURAL_VALIDATION_FAILED"]
}
